{
  "$defs": {
    "actor": {
      "additionalProperties": false,
      "properties": {
        "actorId": {
          "minLength": 1,
          "type": "string"
        },
        "actorType": {
          "enum": [
            "human",
            "agent",
            "kernel"
          ]
        }
      },
      "required": [
        "actorType",
        "actorId"
      ],
      "type": "object"
    },
    "exclusionRef": {
      "additionalProperties": false,
      "properties": {
        "$exclusion": {
          "$ref": "#/$defs/id"
        }
      },
      "required": [
        "$exclusion"
      ],
      "type": "object"
    },
    "gapRef": {
      "additionalProperties": false,
      "properties": {
        "$gap": {
          "$ref": "#/$defs/id"
        }
      },
      "required": [
        "$gap"
      ],
      "type": "object"
    },
    "id": {
      "pattern": "^[a-z0-9][a-z0-9._:-]*$",
      "type": "string"
    },
    "provenance": {
      "additionalProperties": false,
      "properties": {
        "extractedAt": {
          "type": "string"
        },
        "extractor": {
          "type": "string"
        },
        "locator": {
          "type": "string"
        },
        "sourceArtifact": {
          "type": "string"
        }
      },
      "required": [
        "sourceArtifact",
        "locator",
        "extractor",
        "extractedAt"
      ],
      "type": "object"
    },
    "timestamp": {
      "pattern": "^\\d{4}-\\d{2}-\\d{2}(T\\d{2}:\\d{2}:\\d{2}(\\.\\d+)?Z)?$",
      "type": "string"
    }
  },
  "$id": "https://docket.offgriddevices.com/schema/Risk.schema.json",
  "$schema": "https://json-schema.org/draft/2020-12/schema",
  "additionalProperties": false,
  "description": "",
  "properties": {
    "acceptanceCriteria": {
      "type": "string"
    },
    "confidence": {
      "enum": [
        "explicit",
        "inferred",
        "absent"
      ]
    },
    "consequence": {
      "type": "string"
    },
    "createdAt": {
      "$ref": "#/$defs/timestamp"
    },
    "createdBy": {
      "$ref": "#/$defs/actor"
    },
    "evidence": {
      "items": {
        "$ref": "#/$defs/id"
      },
      "type": "array"
    },
    "id": {
      "$ref": "#/$defs/id"
    },
    "ingestionProvenance": {
      "$ref": "#/$defs/provenance"
    },
    "kind": {
      "enum": [
        "bias-anchoring",
        "bias-confirmation",
        "bias-selection",
        "bias-over-specification",
        "method",
        "data",
        "schedule",
        "other"
      ]
    },
    "mitigation": {
      "items": {
        "$ref": "#/$defs/id"
      },
      "type": "array"
    },
    "monitor": {
      "type": "string"
    },
    "owner": {
      "type": "string"
    },
    "rev": {
      "minimum": 1,
      "type": "integer"
    },
    "statement": {
      "type": "string"
    },
    "status": {
      "enum": [
        "open",
        "mitigated",
        "accepted",
        "closed"
      ]
    },
    "supersedes": {
      "$ref": "#/$defs/id"
    },
    "type": {
      "const": "Risk"
    },
    "uncertainty": {
      "$ref": "#/$defs/id"
    }
  },
  "required": [
    "id",
    "type",
    "rev",
    "createdBy",
    "createdAt",
    "statement",
    "kind",
    "consequence",
    "owner",
    "status"
  ],
  "title": "Risk",
  "type": "object"
}
