{
  "consequence": "perceived bias in the selection of analyses (GAO-23-106549 F2/F3)",
  "createdAt": "2026-09-06T00:00:00Z",
  "createdBy": {
    "actorId": "docket-kernel/0.1.0",
    "actorType": "kernel"
  },
  "evidence": [
    "cl-concepts-outperform-m2a4",
    "ep-omfv-2020-02",
    "ep-omfv-2020-02-r2",
    "ep-omfv-2020-02-r3",
    "ep-omfv-2020-02-r4",
    "ep-omfv-2020-02-r4-dc",
    "ep-omfv-2020-02-r4-fs",
    "ep-omfv-2020-02-r5",
    "ev-abct-opconcept",
    "ev-aries-1",
    "ev-aries-2",
    "ev-bradley-swapc-2018",
    "ev-breaking-defense",
    "ev-con-2020-02",
    "ev-con-2020-12",
    "ev-concept-design-2021",
    "ev-hsi-1",
    "ev-hsi-2",
    "ev-industry-day-narrative-2020-04",
    "ev-market-research-2020",
    "ev-market-research-study-2020",
    "ev-mbl-1",
    "ev-threat-analysis",
    "ev-trac-aoa",
    "ev-trac-oe",
    "ev-vendor-feedback-1",
    "ev-vendor-feedback-2",
    "ev-vendor-feedback-3",
    "ev-vendor-feedback-4",
    "ex-phase2-concepts-not-selected"
  ],
  "id": "risk-bias-ep-omfv-2020-02-r4-ce-selection",
  "kind": "bias-selection",
  "owner": "unassigned",
  "rev": 2,
  "statement": "evidence excluded without a typed reason, or included without a stated reason",
  "status": "open",
  "type": "Risk"
}
